{
  "actionKind": "nativeAction",
  "actionSummary": "执行第 2 步点击操作（源事件 1f550bc4-6d72-4354-8d23-2bece77eaf6b）。",
  "appContext": {
    "appBundleId": "com.tencent.qq",
    "appName": "QQ",
    "windowId": null,
    "windowSignature": null,
    "windowTitle": null
  },
  "endedAt": "2026-03-10T06:34:15.536Z",
  "execution": null,
  "intentSummary": "在 QQ 中复现任务 task-session-gui-4589dbd7-teaching-20260310-143404-002 的操作流程",
  "learningState": "reviewed",
  "mode": "teaching",
  "observationRef": {
    "appContext": {
      "appBundleId": "com.tencent.qq",
      "appName": "QQ",
      "windowId": null,
      "windowSignature": null,
      "windowTitle": null
    },
    "axRefs": [],
    "eventIds": [
      "1f550bc4-6d72-4354-8d23-2bece77eaf6b"
    ],
    "note": "Backfilled from raw event sidecar; screenshot/AX/OCR refs stay empty until ObservationBundle lands.",
    "ocrRefs": [],
    "rawEventLogPath": "data/raw-events/2026-03-10/session-gui-4589dbd7-teaching-20260310-143404.jsonl",
    "screenshotRefs": [],
    "sourceRecordPath": "data/benchmarks/personal-desktop/generated/pdb-007-qq-chat-navigation/source-record.json",
    "taskChunkPath": "data/task-chunks/2026-03-10/task-session-gui-4589dbd7-teaching-20260310-143404-002.json"
  },
  "privacyTags": [],
  "review": {
    "decision": "approved",
    "note": null,
    "rawRef": "data/benchmarks/personal-desktop/generated/pdb-007-qq-chat-navigation/review-result.json",
    "reviewId": "benchmark-review-pdb-007-qq-chat-navigation",
    "reviewedAt": "2026-03-14T01:54:09+08:00",
    "source": "benchmarkResult",
    "summary": "skill preflight=failed; runtime=blocked; steps=0/0; expectedPreflight=failed; expectedRuntime=blocked"
  },
  "riskLevel": "medium",
  "schemaVersion": "openstaff.learning.interaction-turn.v0",
  "semanticTargetSetRef": {
    "candidateCount": 0,
    "preferredLocatorType": null,
    "semanticTargets": [],
    "sourcePath": "data/benchmarks/personal-desktop/generated/pdb-007-qq-chat-navigation/benchmark-pdb-007-qq-chat-navigation/openstaff-skill.json",
    "sourceStepId": "step-002"
  },
  "sessionId": "session-gui-4589dbd7-teaching-20260310-143404",
  "sourceRefs": [
    {
      "artifactKind": "sourceRecord",
      "identifier": "pdb-007-qq-chat-navigation",
      "path": "data/benchmarks/personal-desktop/generated/pdb-007-qq-chat-navigation/source-record.json",
      "sha256": null
    },
    {
      "artifactKind": "caseReport",
      "identifier": "pdb-007-qq-chat-navigation",
      "path": "data/benchmarks/personal-desktop/generated/pdb-007-qq-chat-navigation/case-report.json",
      "sha256": null
    },
    {
      "artifactKind": "rawEventLog",
      "identifier": "session-gui-4589dbd7-teaching-20260310-143404",
      "path": "data/raw-events/2026-03-10/session-gui-4589dbd7-teaching-20260310-143404.jsonl",
      "sha256": "a46e52401bf4ce2137348e373623a343c3681ac01b8078eeaf68686e4497de55"
    },
    {
      "artifactKind": "taskChunk",
      "identifier": "task-session-gui-4589dbd7-teaching-20260310-143404-002",
      "path": "data/task-chunks/2026-03-10/task-session-gui-4589dbd7-teaching-20260310-143404-002.json",
      "sha256": "67c8dc4bdd1318f87cd9ef357017046eb454b264e9982336223df5cb69eec862"
    },
    {
      "artifactKind": "knowledgeItem",
      "identifier": "ki-task-session-gui-4589dbd7-teaching-20260310-143404-002",
      "path": "data/knowledge/2026-03-10/task-session-gui-4589dbd7-teaching-20260310-143404-002.json",
      "sha256": "0eaccb6d94f2eaeed2c631ed61adbfa0a3ae31b1a220c1c355f3e792cc1c020a"
    },
    {
      "artifactKind": "skillBundle",
      "identifier": "benchmark-pdb-007-qq-chat-navigation",
      "path": "data/benchmarks/personal-desktop/generated/pdb-007-qq-chat-navigation/benchmark-pdb-007-qq-chat-navigation/openstaff-skill.json",
      "sha256": null
    },
    {
      "artifactKind": "executionResult",
      "identifier": "trace-openclaw-run-a98af2de-aa01-44c2-ba54-4c65f5bf8b02",
      "path": "data/benchmarks/personal-desktop/generated/pdb-007-qq-chat-navigation/execution-result.json",
      "sha256": null
    },
    {
      "artifactKind": "benchmarkReview",
      "identifier": "pdb-007-qq-chat-navigation",
      "path": "data/benchmarks/personal-desktop/generated/pdb-007-qq-chat-navigation/review-result.json",
      "sha256": null
    }
  ],
  "startedAt": "2026-03-10T06:34:15.536Z",
  "status": "captured",
  "stepId": "step-002",
  "stepIndex": 2,
  "stepReference": {
    "instruction": "执行第 2 步点击操作（源事件 1f550bc4-6d72-4354-8d23-2bece77eaf6b）。",
    "knowledgeItemId": "ki-task-session-gui-4589dbd7-teaching-20260310-143404-002",
    "knowledgeStepId": "step-002",
    "planStepId": null,
    "skillStepId": "step-002",
    "sourceEventIds": [
      "1f550bc4-6d72-4354-8d23-2bece77eaf6b"
    ],
    "stepId": "step-002",
    "stepIndex": 2
  },
  "taskId": "task-session-gui-4589dbd7-teaching-20260310-143404-002",
  "traceId": "trace-learning-teaching-task-session-gui-4589dbd7-teaching-20260310-143404-002-step-002",
  "turnId": "turn-teaching-taskProgression-task-session-gui-4589dbd7-teaching-20260310-143404-002-step-002",
  "turnKind": "taskProgression"
}
