{
  "actionKind": "guiAction",
  "actionSummary": "执行第 8 步点击操作（x=326, y=724，源事件 c90c4ca0-a342-49a7-ae4e-f64f0ef91c8c）。",
  "appContext": {
    "appBundleId": "com.apple.dt.Xcode",
    "appName": "Xcode",
    "windowId": null,
    "windowSignature": null,
    "windowTitle": "macos — Package.swift"
  },
  "endedAt": "2026-03-13T17:54:09.055Z",
  "execution": {
    "component": "student.openclaw.runner.step",
    "errorCode": null,
    "executionLogPath": "data/benchmarks/personal-desktop/generated/pdb-003-xcode-package-navigation-c/logs/2026-03-13/session-gui-25d0d2ed-teaching-20260310-204424-openclaw.log",
    "executionResultPath": "data/benchmarks/personal-desktop/generated/pdb-003-xcode-package-navigation-c/execution-result.json",
    "planId": null,
    "planStepId": null,
    "reviewId": "openclaw-review-trace-openclaw-run-e1624bfe-db72-449c-a388-af4138951395",
    "skillDirectoryPath": "data/benchmarks/personal-desktop/generated/pdb-003-xcode-package-navigation-c/benchmark-pdb-003-xcode-package-navigation-c",
    "skillName": "benchmark-pdb-003-xcode-package-navigation-c",
    "status": "succeeded",
    "traceId": "trace-openclaw-run-e1624bfe-db72-449c-a388-af4138951395"
  },
  "intentSummary": "在 Xcode 中复现任务 task-session-gui-25d0d2ed-teaching-20260310-204424-001 的操作流程",
  "learningState": "reviewed",
  "mode": "student",
  "observationRef": {
    "appContext": {
      "appBundleId": "com.apple.dt.Xcode",
      "appName": "Xcode",
      "windowId": null,
      "windowSignature": null,
      "windowTitle": "macos — Package.swift"
    },
    "axRefs": [],
    "eventIds": [
      "c90c4ca0-a342-49a7-ae4e-f64f0ef91c8c"
    ],
    "note": "Backfilled from raw event sidecar; screenshot/AX/OCR refs stay empty until ObservationBundle lands.",
    "ocrRefs": [],
    "rawEventLogPath": "data/raw-events/2026-03-10/session-gui-25d0d2ed-teaching-20260310-204424.jsonl",
    "screenshotRefs": [],
    "sourceRecordPath": "data/benchmarks/personal-desktop/generated/pdb-003-xcode-package-navigation-c/source-record.json",
    "taskChunkPath": "data/task-chunks/2026-03-10/task-session-gui-25d0d2ed-teaching-20260310-204424-001.json"
  },
  "privacyTags": [],
  "review": {
    "decision": "approved",
    "note": "Benchmark runner injects teacher confirmation to validate deterministic runtime execution for confirmation-gated skills.",
    "rawRef": "data/benchmarks/personal-desktop/generated/pdb-003-xcode-package-navigation-c/review-result.json",
    "reviewId": "benchmark-review-pdb-003-xcode-package-navigation-c",
    "reviewedAt": "2026-03-14T01:54:09+08:00",
    "source": "benchmarkResult",
    "summary": "skill preflight=needs_teacher_confirmation; runtime=succeeded; steps=8/8; expectedPreflight=needs_teacher_confirmation; expectedRuntime=succeeded"
  },
  "riskLevel": "high",
  "schemaVersion": "openstaff.learning.interaction-turn.v0",
  "semanticTargetSetRef": {
    "candidateCount": 1,
    "preferredLocatorType": "coordinateFallback",
    "semanticTargets": [
      {
        "appBundleId": "com.apple.dt.Xcode",
        "boundingRect": {
          "coordinateSpace": "screen",
          "height": 1,
          "width": 1,
          "x": 326,
          "y": 724
        },
        "confidence": 0.24,
        "locatorType": "coordinateFallback",
        "source": "skill-mapper-fallback",
        "windowTitlePattern": "^macos\\ —\\ Package\\.swift$"
      }
    ],
    "sourcePath": "data/benchmarks/personal-desktop/generated/pdb-003-xcode-package-navigation-c/benchmark-pdb-003-xcode-package-navigation-c/openstaff-skill.json",
    "sourceStepId": "step-008"
  },
  "sessionId": "session-gui-25d0d2ed-teaching-20260310-204424",
  "sourceRefs": [
    {
      "artifactKind": "sourceRecord",
      "identifier": "pdb-003-xcode-package-navigation-c",
      "path": "data/benchmarks/personal-desktop/generated/pdb-003-xcode-package-navigation-c/source-record.json",
      "sha256": null
    },
    {
      "artifactKind": "caseReport",
      "identifier": "pdb-003-xcode-package-navigation-c",
      "path": "data/benchmarks/personal-desktop/generated/pdb-003-xcode-package-navigation-c/case-report.json",
      "sha256": null
    },
    {
      "artifactKind": "rawEventLog",
      "identifier": "session-gui-25d0d2ed-teaching-20260310-204424",
      "path": "data/raw-events/2026-03-10/session-gui-25d0d2ed-teaching-20260310-204424.jsonl",
      "sha256": "7f941e851138baf3656df8bcc9f2ceac26eddc8b831d96f8f4c762ca80c70c61"
    },
    {
      "artifactKind": "taskChunk",
      "identifier": "task-session-gui-25d0d2ed-teaching-20260310-204424-001",
      "path": "data/task-chunks/2026-03-10/task-session-gui-25d0d2ed-teaching-20260310-204424-001.json",
      "sha256": "8c0072c79543de12c29a00665e89ed2869229d7505cb2277af20ac7382ae4659"
    },
    {
      "artifactKind": "knowledgeItem",
      "identifier": "ki-task-session-gui-25d0d2ed-teaching-20260310-204424-001",
      "path": "data/knowledge/2026-03-10/task-session-gui-25d0d2ed-teaching-20260310-204424-001.json",
      "sha256": "75b8f27521e9bd5310a420cff8dcbff8eb9e9eeb58252624783e69e2c8312dff"
    },
    {
      "artifactKind": "skillBundle",
      "identifier": "benchmark-pdb-003-xcode-package-navigation-c",
      "path": "data/benchmarks/personal-desktop/generated/pdb-003-xcode-package-navigation-c/benchmark-pdb-003-xcode-package-navigation-c/openstaff-skill.json",
      "sha256": null
    },
    {
      "artifactKind": "executionResult",
      "identifier": "trace-openclaw-run-e1624bfe-db72-449c-a388-af4138951395",
      "path": "data/benchmarks/personal-desktop/generated/pdb-003-xcode-package-navigation-c/execution-result.json",
      "sha256": null
    },
    {
      "artifactKind": "benchmarkReview",
      "identifier": "pdb-003-xcode-package-navigation-c",
      "path": "data/benchmarks/personal-desktop/generated/pdb-003-xcode-package-navigation-c/review-result.json",
      "sha256": null
    }
  ],
  "startedAt": "2026-03-13T17:54:09.054Z",
  "status": "succeeded",
  "stepId": "step-008",
  "stepIndex": 8,
  "stepReference": {
    "instruction": "执行第 8 步点击操作（x=326, y=724，源事件 c90c4ca0-a342-49a7-ae4e-f64f0ef91c8c）。",
    "knowledgeItemId": "ki-task-session-gui-25d0d2ed-teaching-20260310-204424-001",
    "knowledgeStepId": "step-008",
    "planStepId": null,
    "skillStepId": "step-008",
    "sourceEventIds": [
      "c90c4ca0-a342-49a7-ae4e-f64f0ef91c8c"
    ],
    "stepId": "step-008",
    "stepIndex": 8
  },
  "taskId": "task-session-gui-25d0d2ed-teaching-20260310-204424-001",
  "traceId": "trace-openclaw-run-e1624bfe-db72-449c-a388-af4138951395",
  "turnId": "turn-student-skillExecution-task-session-gui-25d0d2ed-teaching-20260310-204424-001-step-008",
  "turnKind": "skillExecution"
}
