{
  "actionKind": "guiAction",
  "actionSummary": "执行第 1 步点击操作（x=538, y=43，源事件 2a50f718-c3ba-46e0-800f-2e4475858053）。",
  "appContext": {
    "appBundleId": "com.apple.dt.Xcode",
    "appName": "Xcode",
    "windowId": null,
    "windowSignature": null,
    "windowTitle": "macos — Package.swift"
  },
  "endedAt": "2026-03-10T12:45:33.489Z",
  "execution": {
    "component": "student.openclaw.runner.step",
    "errorCode": null,
    "executionLogPath": "data/benchmarks/personal-desktop/generated/pdb-002-xcode-package-navigation-b/logs/2026-03-13/session-gui-0cacb6a5-teaching-20260310-204532-openclaw.log",
    "executionResultPath": "data/benchmarks/personal-desktop/generated/pdb-002-xcode-package-navigation-b/execution-result.json",
    "planId": null,
    "planStepId": null,
    "reviewId": "openclaw-review-trace-openclaw-run-78411950-990f-4087-ab3d-51732f230513",
    "skillDirectoryPath": "data/benchmarks/personal-desktop/generated/pdb-002-xcode-package-navigation-b/benchmark-pdb-002-xcode-package-navigation-b",
    "skillName": "benchmark-pdb-002-xcode-package-navigation-b",
    "status": "succeeded",
    "traceId": "trace-openclaw-run-78411950-990f-4087-ab3d-51732f230513"
  },
  "intentSummary": "在 Xcode 中复现任务 task-session-gui-0cacb6a5-teaching-20260310-204532-001 的操作流程",
  "learningState": "reviewed",
  "mode": "teaching",
  "observationRef": {
    "appContext": {
      "appBundleId": "com.apple.dt.Xcode",
      "appName": "Xcode",
      "windowId": null,
      "windowSignature": null,
      "windowTitle": "macos — Package.swift"
    },
    "axRefs": [],
    "eventIds": [
      "2a50f718-c3ba-46e0-800f-2e4475858053"
    ],
    "note": "Backfilled from raw event sidecar; screenshot/AX/OCR refs stay empty until ObservationBundle lands.",
    "ocrRefs": [],
    "rawEventLogPath": "data/raw-events/2026-03-10/session-gui-0cacb6a5-teaching-20260310-204532.jsonl",
    "screenshotRefs": [],
    "sourceRecordPath": "data/benchmarks/personal-desktop/generated/pdb-002-xcode-package-navigation-b/source-record.json",
    "taskChunkPath": "data/task-chunks/2026-03-10/task-session-gui-0cacb6a5-teaching-20260310-204532-001.json"
  },
  "privacyTags": [],
  "review": {
    "decision": "approved",
    "note": "Benchmark runner injects teacher confirmation to validate deterministic runtime execution for confirmation-gated skills.",
    "rawRef": "data/benchmarks/personal-desktop/generated/pdb-002-xcode-package-navigation-b/review-result.json",
    "reviewId": "benchmark-review-pdb-002-xcode-package-navigation-b",
    "reviewedAt": "2026-03-14T01:54:08+08:00",
    "source": "benchmarkResult",
    "summary": "skill preflight=needs_teacher_confirmation; runtime=succeeded; steps=6/6; expectedPreflight=needs_teacher_confirmation; expectedRuntime=succeeded"
  },
  "riskLevel": "high",
  "schemaVersion": "openstaff.learning.interaction-turn.v0",
  "semanticTargetSetRef": {
    "candidateCount": 1,
    "preferredLocatorType": "coordinateFallback",
    "semanticTargets": [
      {
        "appBundleId": "com.apple.dt.Xcode",
        "boundingRect": {
          "coordinateSpace": "screen",
          "height": 1,
          "width": 1,
          "x": 538,
          "y": 43
        },
        "confidence": 0.24,
        "locatorType": "coordinateFallback",
        "source": "skill-mapper-fallback",
        "windowTitlePattern": "^macos\\ —\\ Package\\.swift$"
      }
    ],
    "sourcePath": "data/benchmarks/personal-desktop/generated/pdb-002-xcode-package-navigation-b/benchmark-pdb-002-xcode-package-navigation-b/openstaff-skill.json",
    "sourceStepId": "step-001"
  },
  "sessionId": "session-gui-0cacb6a5-teaching-20260310-204532",
  "sourceRefs": [
    {
      "artifactKind": "sourceRecord",
      "identifier": "pdb-002-xcode-package-navigation-b",
      "path": "data/benchmarks/personal-desktop/generated/pdb-002-xcode-package-navigation-b/source-record.json",
      "sha256": null
    },
    {
      "artifactKind": "caseReport",
      "identifier": "pdb-002-xcode-package-navigation-b",
      "path": "data/benchmarks/personal-desktop/generated/pdb-002-xcode-package-navigation-b/case-report.json",
      "sha256": null
    },
    {
      "artifactKind": "rawEventLog",
      "identifier": "session-gui-0cacb6a5-teaching-20260310-204532",
      "path": "data/raw-events/2026-03-10/session-gui-0cacb6a5-teaching-20260310-204532.jsonl",
      "sha256": "9195616eb786c00defa85c4668f38cfef751bde855ab1a71d987b5f94fabae51"
    },
    {
      "artifactKind": "taskChunk",
      "identifier": "task-session-gui-0cacb6a5-teaching-20260310-204532-001",
      "path": "data/task-chunks/2026-03-10/task-session-gui-0cacb6a5-teaching-20260310-204532-001.json",
      "sha256": "0a00989c3b5dcef5b23bb9d91772a813f4cf423e5ce0c046ee2ede391c3056c9"
    },
    {
      "artifactKind": "knowledgeItem",
      "identifier": "ki-task-session-gui-0cacb6a5-teaching-20260310-204532-001",
      "path": "data/knowledge/2026-03-10/task-session-gui-0cacb6a5-teaching-20260310-204532-001.json",
      "sha256": "f912212907d0c3988666335d66997a5ee61d9a68e2f42c7f378befc86694ea9d"
    },
    {
      "artifactKind": "skillBundle",
      "identifier": "benchmark-pdb-002-xcode-package-navigation-b",
      "path": "data/benchmarks/personal-desktop/generated/pdb-002-xcode-package-navigation-b/benchmark-pdb-002-xcode-package-navigation-b/openstaff-skill.json",
      "sha256": null
    },
    {
      "artifactKind": "executionResult",
      "identifier": "trace-openclaw-run-78411950-990f-4087-ab3d-51732f230513",
      "path": "data/benchmarks/personal-desktop/generated/pdb-002-xcode-package-navigation-b/execution-result.json",
      "sha256": null
    },
    {
      "artifactKind": "benchmarkReview",
      "identifier": "pdb-002-xcode-package-navigation-b",
      "path": "data/benchmarks/personal-desktop/generated/pdb-002-xcode-package-navigation-b/review-result.json",
      "sha256": null
    }
  ],
  "startedAt": "2026-03-10T12:45:33.489Z",
  "status": "captured",
  "stepId": "step-001",
  "stepIndex": 1,
  "stepReference": {
    "instruction": "执行第 1 步点击操作（x=538, y=43，源事件 2a50f718-c3ba-46e0-800f-2e4475858053）。",
    "knowledgeItemId": "ki-task-session-gui-0cacb6a5-teaching-20260310-204532-001",
    "knowledgeStepId": "step-001",
    "planStepId": null,
    "skillStepId": "step-001",
    "sourceEventIds": [
      "2a50f718-c3ba-46e0-800f-2e4475858053"
    ],
    "stepId": "step-001",
    "stepIndex": 1
  },
  "taskId": "task-session-gui-0cacb6a5-teaching-20260310-204532-001",
  "traceId": "trace-learning-teaching-task-session-gui-0cacb6a5-teaching-20260310-204532-001-step-001",
  "turnId": "turn-teaching-taskProgression-task-session-gui-0cacb6a5-teaching-20260310-204532-001-step-001",
  "turnKind": "taskProgression"
}
