{
  "actionKind": "guiAction",
  "actionSummary": "执行第 2 步点击操作（源事件 a4f2f7db-3ad7-4c8f-ac54-411f7a4f9458）。",
  "appContext": {
    "appBundleId": "com.apple.systempreferences",
    "appName": "系统设置",
    "windowId": null,
    "windowSignature": null,
    "windowTitle": null
  },
  "endedAt": "2026-03-10T10:35:23.204Z",
  "execution": {
    "component": "student.loop",
    "errorCode": null,
    "executionLogPath": "data/logs/2026-03-10/session-gui-a3f4231f-student.log",
    "executionResultPath": "data/reports/2026-03-10/session-gui-a3f4231f-task-session-gui-b3e503cf-teaching-20260310-164817-001-student-review.json",
    "planId": "student-plan-task-session-gui-b3e503cf-teaching-20260310-164817-001",
    "planStepId": "plan-step-002",
    "reviewId": "student-review-session-gui-a3f4231f-task-session-gui-b3e503cf-teaching-20260310-164817-001",
    "skillDirectoryPath": "data/benchmarks/personal-desktop/generated/pdb-013-system-settings-navigation/benchmark-pdb-013-system-settings-navigation",
    "skillName": "benchmark-pdb-013-system-settings-navigation",
    "status": "succeeded",
    "traceId": "trace-gui-student-c473a75e-d452-41cb-8244-4f001bd778a0"
  },
  "intentSummary": "在 系统设置 中复现任务 task-session-gui-b3e503cf-teaching-20260310-164817-001 的操作流程",
  "learningState": "linked",
  "mode": "student",
  "observationRef": {
    "appContext": {
      "appBundleId": "com.apple.systempreferences",
      "appName": "系统设置",
      "windowId": null,
      "windowSignature": null,
      "windowTitle": null
    },
    "axRefs": [],
    "eventIds": [
      "a4f2f7db-3ad7-4c8f-ac54-411f7a4f9458"
    ],
    "note": "Backfilled from raw event sidecar; screenshot/AX/OCR refs stay empty until ObservationBundle lands.",
    "ocrRefs": [],
    "rawEventLogPath": "data/raw-events/2026-03-10/session-gui-b3e503cf-teaching-20260310-164817.jsonl",
    "screenshotRefs": [],
    "sourceRecordPath": null,
    "taskChunkPath": "data/task-chunks/2026-03-10/task-session-gui-b3e503cf-teaching-20260310-164817-001.json"
  },
  "privacyTags": [],
  "review": null,
  "riskLevel": "low",
  "schemaVersion": "openstaff.learning.interaction-turn.v0",
  "semanticTargetSetRef": {
    "candidateCount": 0,
    "preferredLocatorType": null,
    "semanticTargets": [],
    "sourcePath": "data/benchmarks/personal-desktop/generated/pdb-013-system-settings-navigation/benchmark-pdb-013-system-settings-navigation/openstaff-skill.json",
    "sourceStepId": "step-002"
  },
  "sessionId": "session-gui-a3f4231f",
  "sourceRefs": [
    {
      "artifactKind": "studentReview",
      "identifier": "student-review-session-gui-a3f4231f-task-session-gui-b3e503cf-teaching-20260310-164817-001",
      "path": "data/reports/2026-03-10/session-gui-a3f4231f-task-session-gui-b3e503cf-teaching-20260310-164817-001-student-review.json",
      "sha256": null
    },
    {
      "artifactKind": "studentLog",
      "identifier": "trace-gui-student-c473a75e-d452-41cb-8244-4f001bd778a0",
      "path": "data/logs/2026-03-10/session-gui-a3f4231f-student.log",
      "sha256": null
    },
    {
      "artifactKind": "knowledgeItem",
      "identifier": "ki-task-session-gui-b3e503cf-teaching-20260310-164817-001",
      "path": "data/knowledge/2026-03-10/task-session-gui-b3e503cf-teaching-20260310-164817-001.json",
      "sha256": null
    },
    {
      "artifactKind": "skillBundle",
      "identifier": "benchmark-pdb-013-system-settings-navigation",
      "path": "data/benchmarks/personal-desktop/generated/pdb-013-system-settings-navigation/benchmark-pdb-013-system-settings-navigation/openstaff-skill.json",
      "sha256": null
    },
    {
      "artifactKind": "taskChunk",
      "identifier": "task-session-gui-b3e503cf-teaching-20260310-164817-001",
      "path": "data/task-chunks/2026-03-10/task-session-gui-b3e503cf-teaching-20260310-164817-001.json",
      "sha256": null
    },
    {
      "artifactKind": "rawEventLog",
      "identifier": "session-gui-b3e503cf-teaching-20260310-164817",
      "path": "data/raw-events/2026-03-10/session-gui-b3e503cf-teaching-20260310-164817.jsonl",
      "sha256": null
    }
  ],
  "startedAt": "2026-03-10T10:35:23.204Z",
  "status": "succeeded",
  "stepId": "step-002",
  "stepIndex": 2,
  "stepReference": {
    "instruction": "执行第 2 步点击操作（源事件 a4f2f7db-3ad7-4c8f-ac54-411f7a4f9458）。",
    "knowledgeItemId": "ki-task-session-gui-b3e503cf-teaching-20260310-164817-001",
    "knowledgeStepId": "step-002",
    "planStepId": "plan-step-002",
    "skillStepId": "step-002",
    "sourceEventIds": [
      "a4f2f7db-3ad7-4c8f-ac54-411f7a4f9458"
    ],
    "stepId": "step-002",
    "stepIndex": 2
  },
  "taskId": "task-session-gui-b3e503cf-teaching-20260310-164817-001",
  "traceId": "trace-gui-student-c473a75e-d452-41cb-8244-4f001bd778a0",
  "turnId": "turn-student-skillExecution-task-session-gui-b3e503cf-teaching-20260310-164817-001-step-002",
  "turnKind": "skillExecution"
}
