{
  "actionKind": "guiAction",
  "actionSummary": "执行第 5 步输入\"www.baidu.com\"并按回车（源事件 45f0a6f2-1288-48c9-a226-67f19c5a6b09, cdd1f9e6-737c-4231-ae0e-53b77f9316cb, 5e51a65c-2b35-4103-96ee-d0b50e091923, 45785b7a-e0a2-43a0-8fbf-fedd9b2fa88d, 71c86528-f7a6-4016-b4a0-0f6ef1f06b42, c8590d15-8731-416c-976c-cfe56153f614, 45ca7e4a-90b3-47b1-9cb3-18d5eaaff8ee, 2ba9043e-bf28-42a8-9686-fb34afd075c6, 67decfa2-bcaa-49be-b73f-52583ce38375, d5f28f45-5fbf-4195-bfed-971e501cebb5, 291ce534-feae-4727-aa7c-92c61fd42684, 4c351779-4d14-4d7d-ab8e-3bb250591ff5, bbf632ac-3ba8-45c9-ae73-1c95639ff383, 31f5d6a0-cb3f-4d79-a3b7-3c43f0bae6a1）。",
  "appContext": {
    "appBundleId": "com.apple.dt.Xcode",
    "appName": "Xcode",
    "windowId": null,
    "windowSignature": null,
    "windowTitle": "macos — Package.swift"
  },
  "endedAt": "2026-03-10T12:45:45.836Z",
  "execution": {
    "component": "student.openclaw.runner.step",
    "errorCode": null,
    "executionLogPath": "data/benchmarks/personal-desktop/generated/pdb-002-xcode-package-navigation-b/logs/2026-03-13/session-gui-0cacb6a5-teaching-20260310-204532-openclaw.log",
    "executionResultPath": "data/benchmarks/personal-desktop/generated/pdb-002-xcode-package-navigation-b/execution-result.json",
    "planId": null,
    "planStepId": null,
    "reviewId": "openclaw-review-trace-openclaw-run-78411950-990f-4087-ab3d-51732f230513",
    "skillDirectoryPath": "data/benchmarks/personal-desktop/generated/pdb-002-xcode-package-navigation-b/benchmark-pdb-002-xcode-package-navigation-b",
    "skillName": "benchmark-pdb-002-xcode-package-navigation-b",
    "status": "succeeded",
    "traceId": "trace-openclaw-run-78411950-990f-4087-ab3d-51732f230513"
  },
  "intentSummary": "在 Xcode 中复现任务 task-session-gui-0cacb6a5-teaching-20260310-204532-001 的操作流程",
  "learningState": "reviewed",
  "mode": "teaching",
  "observationRef": {
    "appContext": {
      "appBundleId": "com.apple.dt.Xcode",
      "appName": "Xcode",
      "windowId": null,
      "windowSignature": null,
      "windowTitle": "macos — Package.swift"
    },
    "axRefs": [],
    "eventIds": [
      "45f0a6f2-1288-48c9-a226-67f19c5a6b09",
      "cdd1f9e6-737c-4231-ae0e-53b77f9316cb",
      "5e51a65c-2b35-4103-96ee-d0b50e091923",
      "45785b7a-e0a2-43a0-8fbf-fedd9b2fa88d",
      "71c86528-f7a6-4016-b4a0-0f6ef1f06b42",
      "c8590d15-8731-416c-976c-cfe56153f614",
      "45ca7e4a-90b3-47b1-9cb3-18d5eaaff8ee",
      "2ba9043e-bf28-42a8-9686-fb34afd075c6",
      "67decfa2-bcaa-49be-b73f-52583ce38375",
      "d5f28f45-5fbf-4195-bfed-971e501cebb5",
      "291ce534-feae-4727-aa7c-92c61fd42684",
      "4c351779-4d14-4d7d-ab8e-3bb250591ff5",
      "bbf632ac-3ba8-45c9-ae73-1c95639ff383",
      "31f5d6a0-cb3f-4d79-a3b7-3c43f0bae6a1"
    ],
    "note": "Backfilled from raw event sidecar; screenshot/AX/OCR refs stay empty until ObservationBundle lands.",
    "ocrRefs": [],
    "rawEventLogPath": "data/raw-events/2026-03-10/session-gui-0cacb6a5-teaching-20260310-204532.jsonl",
    "screenshotRefs": [],
    "sourceRecordPath": "data/benchmarks/personal-desktop/generated/pdb-002-xcode-package-navigation-b/source-record.json",
    "taskChunkPath": "data/task-chunks/2026-03-10/task-session-gui-0cacb6a5-teaching-20260310-204532-001.json"
  },
  "privacyTags": [],
  "review": {
    "decision": "approved",
    "note": "Benchmark runner injects teacher confirmation to validate deterministic runtime execution for confirmation-gated skills.",
    "rawRef": "data/benchmarks/personal-desktop/generated/pdb-002-xcode-package-navigation-b/review-result.json",
    "reviewId": "benchmark-review-pdb-002-xcode-package-navigation-b",
    "reviewedAt": "2026-03-14T01:54:08+08:00",
    "source": "benchmarkResult",
    "summary": "skill preflight=needs_teacher_confirmation; runtime=succeeded; steps=6/6; expectedPreflight=needs_teacher_confirmation; expectedRuntime=succeeded"
  },
  "riskLevel": "low",
  "schemaVersion": "openstaff.learning.interaction-turn.v0",
  "semanticTargetSetRef": {
    "candidateCount": 0,
    "preferredLocatorType": null,
    "semanticTargets": [],
    "sourcePath": "data/benchmarks/personal-desktop/generated/pdb-002-xcode-package-navigation-b/benchmark-pdb-002-xcode-package-navigation-b/openstaff-skill.json",
    "sourceStepId": "step-005"
  },
  "sessionId": "session-gui-0cacb6a5-teaching-20260310-204532",
  "sourceRefs": [
    {
      "artifactKind": "sourceRecord",
      "identifier": "pdb-002-xcode-package-navigation-b",
      "path": "data/benchmarks/personal-desktop/generated/pdb-002-xcode-package-navigation-b/source-record.json",
      "sha256": null
    },
    {
      "artifactKind": "caseReport",
      "identifier": "pdb-002-xcode-package-navigation-b",
      "path": "data/benchmarks/personal-desktop/generated/pdb-002-xcode-package-navigation-b/case-report.json",
      "sha256": null
    },
    {
      "artifactKind": "rawEventLog",
      "identifier": "session-gui-0cacb6a5-teaching-20260310-204532",
      "path": "data/raw-events/2026-03-10/session-gui-0cacb6a5-teaching-20260310-204532.jsonl",
      "sha256": "9195616eb786c00defa85c4668f38cfef751bde855ab1a71d987b5f94fabae51"
    },
    {
      "artifactKind": "taskChunk",
      "identifier": "task-session-gui-0cacb6a5-teaching-20260310-204532-001",
      "path": "data/task-chunks/2026-03-10/task-session-gui-0cacb6a5-teaching-20260310-204532-001.json",
      "sha256": "0a00989c3b5dcef5b23bb9d91772a813f4cf423e5ce0c046ee2ede391c3056c9"
    },
    {
      "artifactKind": "knowledgeItem",
      "identifier": "ki-task-session-gui-0cacb6a5-teaching-20260310-204532-001",
      "path": "data/knowledge/2026-03-10/task-session-gui-0cacb6a5-teaching-20260310-204532-001.json",
      "sha256": "f912212907d0c3988666335d66997a5ee61d9a68e2f42c7f378befc86694ea9d"
    },
    {
      "artifactKind": "skillBundle",
      "identifier": "benchmark-pdb-002-xcode-package-navigation-b",
      "path": "data/benchmarks/personal-desktop/generated/pdb-002-xcode-package-navigation-b/benchmark-pdb-002-xcode-package-navigation-b/openstaff-skill.json",
      "sha256": null
    },
    {
      "artifactKind": "executionResult",
      "identifier": "trace-openclaw-run-78411950-990f-4087-ab3d-51732f230513",
      "path": "data/benchmarks/personal-desktop/generated/pdb-002-xcode-package-navigation-b/execution-result.json",
      "sha256": null
    },
    {
      "artifactKind": "benchmarkReview",
      "identifier": "pdb-002-xcode-package-navigation-b",
      "path": "data/benchmarks/personal-desktop/generated/pdb-002-xcode-package-navigation-b/review-result.json",
      "sha256": null
    }
  ],
  "startedAt": "2026-03-10T12:45:41.892Z",
  "status": "captured",
  "stepId": "step-005",
  "stepIndex": 5,
  "stepReference": {
    "instruction": "执行第 5 步输入\"www.baidu.com\"并按回车（源事件 45f0a6f2-1288-48c9-a226-67f19c5a6b09, cdd1f9e6-737c-4231-ae0e-53b77f9316cb, 5e51a65c-2b35-4103-96ee-d0b50e091923, 45785b7a-e0a2-43a0-8fbf-fedd9b2fa88d, 71c86528-f7a6-4016-b4a0-0f6ef1f06b42, c8590d15-8731-416c-976c-cfe56153f614, 45ca7e4a-90b3-47b1-9cb3-18d5eaaff8ee, 2ba9043e-bf28-42a8-9686-fb34afd075c6, 67decfa2-bcaa-49be-b73f-52583ce38375, d5f28f45-5fbf-4195-bfed-971e501cebb5, 291ce534-feae-4727-aa7c-92c61fd42684, 4c351779-4d14-4d7d-ab8e-3bb250591ff5, bbf632ac-3ba8-45c9-ae73-1c95639ff383, 31f5d6a0-cb3f-4d79-a3b7-3c43f0bae6a1）。",
    "knowledgeItemId": "ki-task-session-gui-0cacb6a5-teaching-20260310-204532-001",
    "knowledgeStepId": "step-005",
    "planStepId": null,
    "skillStepId": "step-005",
    "sourceEventIds": [
      "45f0a6f2-1288-48c9-a226-67f19c5a6b09",
      "cdd1f9e6-737c-4231-ae0e-53b77f9316cb",
      "5e51a65c-2b35-4103-96ee-d0b50e091923",
      "45785b7a-e0a2-43a0-8fbf-fedd9b2fa88d",
      "71c86528-f7a6-4016-b4a0-0f6ef1f06b42",
      "c8590d15-8731-416c-976c-cfe56153f614",
      "45ca7e4a-90b3-47b1-9cb3-18d5eaaff8ee",
      "2ba9043e-bf28-42a8-9686-fb34afd075c6",
      "67decfa2-bcaa-49be-b73f-52583ce38375",
      "d5f28f45-5fbf-4195-bfed-971e501cebb5",
      "291ce534-feae-4727-aa7c-92c61fd42684",
      "4c351779-4d14-4d7d-ab8e-3bb250591ff5",
      "bbf632ac-3ba8-45c9-ae73-1c95639ff383",
      "31f5d6a0-cb3f-4d79-a3b7-3c43f0bae6a1"
    ],
    "stepId": "step-005",
    "stepIndex": 5
  },
  "taskId": "task-session-gui-0cacb6a5-teaching-20260310-204532-001",
  "traceId": "trace-learning-teaching-task-session-gui-0cacb6a5-teaching-20260310-204532-001-step-005",
  "turnId": "turn-teaching-taskProgression-task-session-gui-0cacb6a5-teaching-20260310-204532-001-step-005",
  "turnKind": "taskProgression"
}
